{
  "metadata": {
    "source": "The Rods of Amon Ra - Wesley H. Bateman (1992-1997)",
    "extracted": "2025-12-29",
    "version": "2.0",
    "notes": "Comprehensive extraction from OCR text of original manuscript. Values are Bateman's as printed, not physics claims. Where page-level verification by the lattice's TR node (2026-08/09) found a printed or extracted value damaged, 'value' holds the corrected figure, 'printed_value' keeps what was printed or extracted, and 'verified_by' names the TR post.",
    "verification": "TR-280, TR-281, TR-286, TR-288, TR-298, TR-304, TR-312, TR-320, TR-323, TR-331 (lattice trellis-channel). Spectral values are authorial and must not be normalised toward reference data (TR-283)."
  },
  "fundamental_constants": [
    {
      "name": "Ankh",
      "symbol": "☥",
      "value": 5.08938,
      "units": "unitless (product constant)",
      "symbolic_equivalence": "Red Pi × Green Phi = 3.141592592 × 1.62",
      "function": "Master harmonic constant - 'Number for Life'",
      "used_for": ["dynamic geometry", "coherence scaling", "pyramid proportions", "Grand Gallery ramp (9 × Ankh)"],
      "notes": "Named after Egyptian symbol for life. Appears throughout Great Pyramid dimensions. Key number in Ra System.",
      "source_page": "vol1_page_55"
    },
    {
      "name": "Red Pi",
      "symbol": "π_red",
      "value": 3.141592592,
      "units": "unitless",
      "symbolic_equivalence": "0.78539814 × 4 (derived from ELF/Alpha wave ratio 10.602875/13.5)",
      "function": "Red Trac Pi - Primary Pi value in Ra System",
      "used_for": ["circle calculations", "Red unit conversions", "pyramid geometry"],
      "notes": "Derived from 10.602875 / 13.5 × 4. Less than standard Pi by 0.000000062",
      "source_page": "vol1_page_27"
    },
    {
      "name": "Green Pi",
      "symbol": "π_green",
      "value": 3.142696806,
      "units": "unitless",
      "symbolic_equivalence": "√9.876543210",
      "function": "Green Trac Pi - Secondary Pi value",
      "used_for": ["Green unit calculations", "harmonic ratios"],
      "notes": "Square root of descending digit sequence 9.876543210",
      "source_page": "vol1_page_27"
    },
    {
      "name": "Blue Pi",
      "symbol": "π_blue",
      "value": 3.143801408,
      "units": "unitless",
      "symbolic_equivalence": "1/0.318086250",
      "function": "Blue Trac Pi - Tertiary Pi value",
      "used_for": ["Blue unit calculations", "circle circumference in Blue system"],
      "notes": "Largest of three Pi values. 1/Blue Pi × 2 = RAC 1",
      "source_page": "vol1_page_158"
    },
    {
      "name": "Green Phi",
      "symbol": "φ_green",
      "value": 1.62,
      "units": "unitless",
      "symbolic_equivalence": "Golden ratio approximation (truncated)",
      "conflict": "Volume 1 p.0027 and the vol2a p.0010 master table call 1.62 the Green Phi. The Supplement erratum sheet (g00857_src03_p0002) prints 1.62 as the OMEGA MAJOR Phi and Green Phi = 1.629174025. The erratum supersedes (TR-312); 1.62 is also the Ankh wheel diameter (volume_1 p.0168, TR-298).",
      "verified_by": "FP-1399, TR-312, TR-316",
      "function": "Threshold harmonic - shapes of plant/animal life",
      "used_for": ["access gating", "partial emergence tuning", "biometric thresholds"],
      "notes": "Relates to shapes and proportion of plant and animal life. Core component of Ankh.",
      "source_page": "vol1_page_55"
    },
    {
      "name": "Phi (full precision)",
      "value": 1.6286016,
      "printed_value": 1.619430799,
      "units": "unitless",
      "symbolic_equivalence": "Red Phi = 1.62 × 84823/84375 (Omega Major Phi × Omega/r)",
      "correction": "Bateman's own erratum (supplement g00857_src03_p0002): 'On each and every data form found in Volume 2 (books A and B) and Volume 3 the value erroneously used for Red Phi was 1.619430799 (1.62 / 1.000351482).' Corrected Red Phi = 1.6286016.",
      "verified_by": "FP-1399, TR-312, TR-316",
      "function": "Precise Phi value in Ra System",
      "used_for": ["pyramid ratio calculations", "coherence thresholds"],
      "source_page": "vol2a_page_194"
    },
    {
      "name": "81 Divisor",
      "value": 81,
      "units": "unitless",
      "symbolic_equivalence": "1.62 ÷ 2 × 9 × 9 = 3⁴",
      "function": "Elemental divisor - hydrogen/helium/lithium relationship",
      "used_for": ["Repitan derivation", "elemental structure mapping", "spectral geometry"],
      "notes": "Relates Green Phi to basic elements. 3/81 = 0.037 (first Repitan). 729 = 81 × 9 = 27th T.O.N.",
      "source_page": "vol1_page_60"
    },
    {
      "name": "Hunab",
      "symbol": "Hu",
      "value": 1.0602875,
      "units": "meters (linear) or unitless (scalar)",
      "symbolic_equivalence": "10.602875 Hz / 10 (ELF dominant frequency)",
      "function": "Harmonic scalar unit - Mayan God of Measure",
      "used_for": ["time dilation", "frequency conversion", "unit conversion", "alpha brainwave reference"],
      "notes": "Named after Aztec God 'Hunab Ku'. Most frequent ELF/Alpha wave frequency. H-Bar Trac Mate.",
      "source_page": "vol1_page_27"
    },
    {
      "name": "H-Bar (Omega Major)",
      "value": 1.0546875,
      "units": "unitless",
      "symbolic_equivalence": "Green Hunab / Omega Ratio = 1.060660172 / 1.005662978 = 135/128 (the Omega Major window of the Hunab row)",
      "function": "Bateman's H-Bar - named after the reduced Planck constant; not the physical value",
      "verified_by": "TR-304 (vol2a g00194_src01_p0010 KEY NUMBERS), TR-312",
      "used_for": ["quantum calculations", "spectral line analysis", "wave mechanics"],
      "notes": "Universal Constant of Action in quantumized atom. Trac Mate of alpha brainwave frequency (10.602875 Hz).",
      "source_page": "vol2a_page_193"
    },
    {
      "name": "Planck's Constant H (Omega Major)",
      "value": 0.6629126072,
      "units": "unitless",
      "symbolic_equivalence": "18th Repitan (0.666666) / Omega Ratio",
      "function": "Universal Unit of Action",
      "used_for": ["quantum energy calculations", "photon energy"],
      "source_page": "vol2a_page_193"
    },
    {
      "name": "Fine Structure Constant (Ra)",
      "value": 0.0013717421124829,
      "printed_value": 0.0001371742,
      "units": "unitless",
      "symbolic_equivalence": "1/729 = (1/27)² (printed '.037²'; .037 is 1/27 truncated)",
      "function": "Bateman's f.s.Δ unit (1/729 of a degree, volume_1 folio 165). Not the physical fine-structure constant α = 0.0072973526.",
      "correction": "Printed 10x small in the Supplement (lost decimal, BAT-002) and as .0013742113 on volume_1 p.0105 (dropped digit pair). Witness: 8 × (1/729) = 0.0109739369 reproduces his printed Rydberg.",
      "verified_by": "TR-281, TR-323, TR-331",
      "used_for": ["spectral line calculations", "hydrogen atom structure", "Repitan-T.O.N. link"],
      "notes": "First Repitan squared. Links 27 Repitans to 37 numbers in Table of Nines.",
      "source_page": "vol1_page_79"
    },
    {
      "name": "Key 1 (Red)",
      "value": 1.0602875,
      "units": "Red Rams",
      "symbolic_equivalence": "Hunab value",
      "function": "Primary key number",
      "used_for": ["Hubble constant derivation", "harmonic scaling"],
      "notes": "Same value as Hunab. Key 1 × 90,000 = 95,425.875 (Red Hubble Constant)",
      "source_page": "vol1_page_129"
    },
    {
      "name": "Key 2 (Red √2)",
      "value": 1.41371666,
      "units": "Red units",
      "symbolic_equivalence": "√2 Ra approximation",
      "function": "Secondary key number - diagonal calculations",
      "used_for": ["diagonal calculations", "RAC derivations", "geometric scaling"],
      "notes": "Close to √2 (1.41421356). Key 2 / 2.222 = RAC 1",
      "source_page": "vol1_page_158"
    },
    {
      "name": "Omega Ratio",
      "value": 1.005662978,
      "units": "unitless",
      "symbolic_equivalence": "Q-Ratio adjustment factor",
      "function": "Format conversion between Omega Major and Green",
      "used_for": ["Omega Major/Minor calculations", "pyramid dimension harmonization"],
      "notes": "Green ÷ Omega Ratio = Omega Major. Green × Omega Ratio = Omega Minor.",
      "source_page": "vol2a_page_193"
    }
  ],
  "ra_cubits_racs": [
    {
      "name": "RAC 1",
      "value": 0.6361725,
      "value_meters": 0.639591666,
      "units": "Red Rams",
      "symbolic_equivalence": "Ankh / 8 = 5.08938 / 8",
      "function": "Resonant Access Constant 1 - Prophetic Cubit range",
      "used_for": ["pyramid base division (360 units)", "circle diameter/circumference"],
      "notes": "Close to Prophetic Cubit (0.63569850m). Pyramid base / RAC1 = 360. Also = Red circle diameter / 2.",
      "source_page": "vol1_page_156"
    },
    {
      "name": "RAC 2",
      "value": 0.628318519,
      "value_meters": 0.631695473,
      "units": "Red Rams",
      "symbolic_equivalence": "Red Pi / 5 (TR-298)",
      "function": "Resonant Access Constant 2 - Sacred Cubit range",
      "used_for": ["pyramid base division (364.5 units = Balmer)", "hydrogen resonance", "Lyman-alpha transitions"],
      "notes": "Pyramid base / RAC2 = 364.5 (Balmer Constant). RAC1/RAC2 = 1.0125",
      "source_page": "vol1_page_156"
    },
    {
      "name": "RAC 3",
      "value": 0.57255525,
      "value_meters": 0.5756325,
      "units": "Red Rams",
      "symbolic_equivalence": "Red Pi × 3⁶/4000 = 1.62 × 1.0602875 / 3 (TR-298)",
      "function": "Resonant Access Constant 3 - Pyk Belady range",
      "used_for": ["pyramid base division (400 units)", "harmonic scaling"],
      "notes": "Close to Pyk Belady cubit (0.5773m). Pyramid base / RAC3 = 400",
      "source_page": "vol1_page_157"
    },
    {
      "name": "RAC 4",
      "value": 0.523598765,
      "value_meters": 0.526412894,
      "units": "Red Rams",
      "symbolic_equivalence": "Red Pi / 6 (TR-298)",
      "function": "Resonant Access Constant 4 - Royal Cubit of Memphis range",